{
  "$schema": "../schemas/profile-applicability.schema.json",
  "mapping_version": "1.1.0-development",
  "status": "machine-readable mirror",
  "authority": "requirements/PROFILE_APPLICABILITY.md",
  "gkos_release": "GKOS-2026-09-22 v0.82",
  "qualification_boundary": "This mapping never declares fixture coverage complete or grants a profile claim.",
  "profiles": {
    "GKOS-Core": { "inherits": ["GCP-1", "GCP-2", "GCP-3", "GCP-4", "GCP-5"] },
    "GKOS-Advanced": { "inherits": ["GCP-1", "GCP-2", "GCP-3", "GCP-4", "GCP-5", "GCP-6", "GCP-7"] },
    "GCP-6-Context-Only-Extension": { "inherits": ["GKOS-Core", "GCP-6"], "constraints": ["read-only", "no-consequential-action"] },
    "Viewer-Projection-Profile": { "inherits": [] }
  },
  "requirements": {
    "GKOS-CONFORMANCE-001": { "profiles": ["all-claims", "all-runs"] },
    "GKOS-CONFORMANCE-002": { "profiles": ["all-claims", "all-runs"] },
    "GKOS-CONFORMANCE-003": { "profiles": ["all-claims", "all-runs"] },
    "GKOS-IDENTITY-001": { "profiles": ["GCP-2+"] , "condition": "GKX governed identities are authored or consumed as specified" },
    "GKOS-IDENTITY-002": { "profiles": ["GCP-2+"] , "condition": "GKX governed identities are authored or consumed as specified" },
    "GKOS-IDENTITY-003": { "profiles": ["GCP-2+"] , "condition": "GKX governed identities are authored or consumed as specified" },
    "GKOS-IDENTITY-004": { "profiles": ["GCP-2+"] , "condition": "GKX governed identities are authored or consumed as specified" },
    "GKOS-LINEAGE-001": { "profiles": ["GCP-3+"], "condition": "lineage or supersession is represented" },
    "GKOS-LINEAGE-002": { "profiles": ["GCP-3+"], "condition": "lineage or supersession is represented" },
    "GKOS-LINEAGE-003": { "profiles": ["GCP-3+"], "condition": "lineage or supersession is represented" },
    "GKOS-RECEIPT-001": { "profiles": ["cross-cutting"], "condition": "governed state is committed" },
    "GKOS-RECEIPT-002": { "profiles": ["cross-cutting"], "condition": "governed state is committed" },
    "GKOS-RECEIPT-003": { "profiles": ["cross-cutting"], "condition": "governed state is committed" },
    "GKOS-POLICY-001": { "profiles": ["GCP-4+"], "condition": "a deployment policy or predicate participates in control" },
    "GKOS-RETENTION-001": { "profiles": ["GCP-4", "GCP-7"], "condition": "retention, deletion, or disposition is performed" },
    "GKOS-RETENTION-002": { "profiles": ["GCP-4", "GCP-7"], "condition": "retention, deletion, or disposition is performed" },
    "GKOS-RETENTION-003": { "profiles": ["GCP-4", "GCP-7"], "condition": "retention, deletion, or disposition is performed" },
    "GKOS-REENTRY-001": { "profiles": ["GCP-1"] },
    "GKOS-REENTRY-002": { "profiles": ["cross-cutting"] },
    "GKOS-REENTRY-003": { "profiles": ["GCP-1"], "condition": "plus applicable retention or disposition requirements" },
    "GKOS-REENTRY-004": { "profiles": ["GCP-3", "GCP-4"], "condition": "GCP-4 applies when bounded delegation is used" },
    "GKOS-DELEGATION-001": { "profiles": ["GCP-4"], "condition": "delegation is supported" },
    "GKOS-DELEGATION-002": { "profiles": ["GCP-4"], "condition": "delegation is supported" },
    "GKOS-DELEGATION-003": { "profiles": ["GCP-4"], "condition": "delegation is supported" },
    "GKOS-DELEGATION-004": { "profiles": ["GCP-5"], "condition": "delegated action enters review" },
    "GKOS-DELEGATION-005": { "profiles": ["GCP-4+"], "condition": "bounded delegation is used" },
    "GKOS-DELEGATION-006": { "profiles": ["GCP-5"], "condition": "deferred review governs continued delegation" },
    "GKOS-PROFILE-001": { "profiles": ["GKOS-Core"] },
    "GKOS-PROFILE-002": { "profiles": ["GKOS-Advanced"] },
    "GKOS-PROFILE-003": { "profiles": ["GCP-6-Context-Only-Extension"] },
    "GKOS-PROFILE-004": { "profiles": ["all-claims"] },
    "GKOS-PROFILE-005": { "profiles": ["all-claims"] },
    "GKOS-PROFILE-006": { "profiles": ["all-claims"] },
    "GKOS-PROFILE-007": { "profiles": ["Viewer-Projection-Profile"] },
    "GKOS-CANON-001": { "profiles": ["GCP-6", "GCP-7"], "condition": "or a lower-profile artifact claims canonical GKX-CBOR-1 identity" },
    "GKOS-CANON-002": { "profiles": ["GCP-6", "GCP-7"], "condition": "or a lower-profile artifact claims canonical GKX-CBOR-1 identity" },
    "GKOS-CANON-003": { "profiles": ["GCP-6", "GCP-7"], "condition": "or a lower-profile artifact claims canonical GKX-CBOR-1 identity" },
    "GKOS-CANON-004": { "profiles": ["GCP-6", "GCP-7"], "condition": "or a lower-profile artifact claims canonical GKX-CBOR-1 identity" },
    "GKOS-CANON-005": { "profiles": ["GCP-6", "GCP-7"], "condition": "or a lower-profile artifact claims canonical GKX-CBOR-1 identity" },
    "GKOS-CANON-006": { "profiles": ["GCP-6", "GCP-7"], "condition": "or a lower-profile artifact claims canonical GKX-CBOR-1 identity" },
    "GKOS-CANON-007": { "profiles": ["GCP-6", "GCP-7"], "condition": "or a lower-profile artifact claims canonical GKX-CBOR-1 identity" },
    "GKOS-CANON-008": { "profiles": ["GCP-6", "GCP-7", "GCP-6-Context-Only-Extension"] },
    "GKOS-CONTEXT-001": { "profiles": ["GCP-6+", "GCP-6-Context-Only-Extension"] },
    "GKOS-CONTEXT-002": { "profiles": ["GCP-6+", "GCP-6-Context-Only-Extension"] },
    "GKOS-CONTEXT-003": { "profiles": ["GCP-6+", "GCP-6-Context-Only-Extension"] },
    "GKOS-CONTEXT-004": { "profiles": ["GCP-6+", "GCP-6-Context-Only-Extension"] },
    "GKOS-CONTEXT-005": { "profiles": ["GCP-6+", "GCP-6-Context-Only-Extension"], "condition": "a manifest supports Layer-5 review" },
    "GKOS-AUTHUSE-001": { "profiles": ["GCP-7"] },
    "GKOS-AUTHUSE-002": { "profiles": ["GCP-7"] },
    "GKOS-AUTHUSE-003": { "profiles": ["GCP-7"] },
    "GKOS-AUTHUSE-004": { "profiles": ["GCP-7"] },
    "GKOS-AUTHUSE-005": { "profiles": ["GCP-7"] },
    "GKOS-AUTHUSE-006": { "profiles": ["GCP-7"] },
    "GKOS-AUTHUSE-007": { "profiles": ["GCP-7"] },
    "GKOS-REVIEW-001": { "profiles": ["GCP-5"] },
    "GKOS-REVIEW-002": { "profiles": ["GCP-5"] },
    "GKOS-REVIEW-003": { "profiles": ["GCP-5"] },
    "GKOS-REVIEW-004": { "profiles": ["GCP-5"] },
    "GKOS-DISCLOSURE-001": { "profiles": ["GCP-4+", "GCP-7"], "condition": "protected information is processed or disclosed" },
    "GKOS-EFFECT-001": { "profiles": ["GCP-7"], "condition": "or a lower-layer operation has a mandatory typed effect-scope control" },
    "GKOS-EFFECT-002": { "profiles": ["GCP-7"], "condition": "or a lower-layer operation has a mandatory typed effect-scope control" },
    "GKOS-EFFECT-003": { "profiles": ["GCP-7"], "condition": "or a lower-layer operation has a mandatory typed effect-scope control" }
  }
}
